{
  "schema": "autorig-animal-contact-profile.v1",
  "profile_id": "horse_2.walk_forward.contacts.loop64.v1",
  "revision": 1,
  "rig_type": "HORSE_2",
  "action_id": "walk_forward",
  "loop_unique_frames": 64,
  "gait": "lateral_sequence_walk",
  "foot_order": [
    "hind_left",
    "fore_left",
    "hind_right",
    "fore_right"
  ],
  "forward_axis_world": [
    0.0,
    -1.0,
    0.0
  ],
  "root_motion_policy": "canonical_in_place_optional_derived_root_motion",
  "feet": {
    "hind_left": {
      "bone": "toes_01.l",
      "vertex_ids": [
        37,
        136,
        221,
        135
      ]
    },
    "fore_left": {
      "bone": "toes_01_dupli_001.l",
      "vertex_ids": [
        211,
        212,
        240,
        24
      ]
    },
    "hind_right": {
      "bone": "toes_01.r",
      "vertex_ids": [
        79,
        279,
        181,
        110
      ]
    },
    "fore_right": {
      "bone": "toes_01_dupli_001.r",
      "vertex_ids": [
        270,
        70,
        165,
        168
      ]
    }
  }
}
